{
	"$schema": "../board-definition.schema.json",
	"name": "Manta M4P v2.2",
	"manufacturer": "BIGTREETECH",
	"serialPath": "/dev/btt-manta-m4p-22",
	"firmwareBinaryName": "firmware-btt-manta-m4p-22.bin",
	"compileScript": "compile.sh",
	"flashScript": "flash.sh",
	"flashInstructions": "Flashing only works if the SD card slot on the Manta is empty.",
	"documentationLink": "https://os.ratrig.com/docs/boards/btt/manta-m4p"
}
