{
	"$schema": "../board-definition.schema.json",
	"name": "Manta M5P",
	"manufacturer": "BIGTREETECH",
	"serialPath": "/dev/btt-manta-m5p",
	"firmwareBinaryName": "firmware-btt-manta-m5p.bin",
	"compileScript": "compile.sh",
	"flashScript": "flash.sh",
	"flashInstructions": "Flashing only works if the SD card slot on the Manta is empty.",
	"documentationLink": "https://os.ratrig.com/docs/boards/btt/manta-m5p"
}
