{
	"$schema": "../board-definition.schema.json",
	"name": "BTT-EBB42-10",
	"manufacturer": "BigTreeTech",
	"serialPath": "/dev/btt-ebb42-10",
	"firmwareBinaryName": "firmware-btt-ebb42-10.bin",
	"compileScript": "compile.sh",
	"flashScript": "flash.sh",
	"flashInstructions": "",
	"documentationLink": "https://os.ratrig.com/docs/boards/btt/ebb42-10"
}
